{
  "date": "2026-04-21",
  "currency": "SEK",
  "scrape_time_seconds": 0,
  "sources": [
    "blocket",
    "tradera",
    "vinted"
  ],
  "items": [
    {
      "title": "ASUS TUF Gaming GeForce RTX 3060 Ti OC 8GB GDDR6 GPU grafikkort",
      "url": "https://www.blocket.se/recommerce/forsale/item/22251901",
      "price": 2489,
      "category": "gpu",
      "source": "blocket",
      "original_price": 5500,
      "original_price_is_estimated": true,
      "discount_percent": 55,
      "product_model": "RTX 3060 ti"
    },
    {
      "title": "GeForce RTX 2060 grafikkort (GPU)",
      "url": "https://www.blocket.se/recommerce/forsale/item/22147871",
      "price": 1100,
      "category": "gpu",
      "source": "blocket",
      "original_price": 4000,
      "original_price_is_estimated": true,
      "discount_percent": 72,
      "product_model": "RTX 2060"
    },
    {
      "title": "NVIDIA Tesla P100 AI GPU",
      "url": "https://www.blocket.se/recommerce/forsale/item/22068601",
      "price": 2500,
      "category": "gpu",
      "source": "blocket",
      "original_price": 5000,
      "original_price_is_estimated": true,
      "discount_percent": 50,
      "product_model": "Tesla P100"
    },
    {
      "title": "ASUS Strix GTX 970 4GB – Stabil & prisvärd gaming GPU",
      "url": "https://www.blocket.se/recommerce/forsale/item/21608662",
      "price": 800,
      "category": "gpu",
      "source": "blocket",
      "original_price": 1800,
      "original_price_is_estimated": true,
      "discount_percent": 56,
      "product_model": "GTX 970"
    },
    {
      "title": "GPU Radeon rx 480",
      "url": "https://www.blocket.se/recommerce/forsale/item/21342649",
      "price": 600,
      "category": "gpu",
      "source": "blocket",
      "original_price": 3500,
      "original_price_is_estimated": true,
      "discount_percent": 83,
      "product_model": null
    },
    {
      "title": "Säljer gpu ASUS ROG Strix GeForce STRIX-GTX1080",
      "url": "https://www.blocket.se/recommerce/forsale/item/21307880",
      "price": 1100,
      "category": "gpu",
      "source": "blocket",
      "original_price": 5000,
      "original_price_is_estimated": true,
      "discount_percent": 78,
      "product_model": "GTX 1080"
    },
    {
      "title": "PNY grafikkort med trippelfläkt",
      "url": "https://www.blocket.se/recommerce/forsale/item/22487887",
      "price": 1400,
      "category": "gpu",
      "source": "blocket",
      "original_price": 3500,
      "original_price_is_estimated": true,
      "discount_percent": 60,
      "product_model": null
    },
    {
      "title": "Radeon Rx 5500 XT, 4 GB, PowerColor grafikkort",
      "url": "https://www.blocket.se/recommerce/forsale/item/22472789",
      "price": 595,
      "category": "gpu",
      "source": "blocket",
      "original_price": 13691,
      "original_price_is_estimated": true,
      "discount_percent": 96,
      "product_model": "RX 5500 XT"
    },
    {
      "title": "Asus TUF Gaming GeForce RTX 3060 grafikkort 12 GB GDDR6",
      "url": "https://www.blocket.se/recommerce/forsale/item/22338967",
      "price": 2600,
      "category": "gpu",
      "source": "blocket",
      "original_price": 4500,
      "original_price_is_estimated": true,
      "discount_percent": 42,
      "product_model": "RTX 3060"
    },
    {
      "title": "Asus Dual GeForce RTX 4060 OC 8GB grafikkort svart",
      "url": "https://www.blocket.se/recommerce/forsale/item/22091052",
      "price": 3000,
      "category": "gpu",
      "source": "blocket",
      "original_price": 4500,
      "original_price_is_estimated": true,
      "discount_percent": 33,
      "product_model": "RTX 4060"
    },
    {
      "title": "Zotac GeForce GTX 980 Ti AMP! grafikkort 6 GB GDDR5",
      "url": "https://www.blocket.se/recommerce/forsale/item/22103406",
      "price": 1000,
      "category": "gpu",
      "source": "blocket",
      "original_price": 2500,
      "original_price_is_estimated": true,
      "discount_percent": 60,
      "product_model": "GTX 980 Ti"
    },
    {
      "title": "ONEXGPU bärbart grafikkort eGPU med lagringsplats",
      "url": "https://www.blocket.se/recommerce/forsale/item/22063489",
      "price": 7000,
      "category": "gpu",
      "source": "blocket",
      "original_price": 3500,
      "original_price_is_estimated": true,
      "discount_percent": null,
      "product_model": null
    },
    {
      "title": "XFX GeForce 9800 GTX Black Edition grafikkort",
      "url": "https://www.blocket.se/recommerce/forsale/item/22079247",
      "price": 500,
      "category": "gpu",
      "source": "blocket",
      "original_price": 3500,
      "original_price_is_estimated": true,
      "discount_percent": 86,
      "product_model": null
    },
    {
      "title": "MSI Grafikkort",
      "url": "https://www.blocket.se/recommerce/forsale/item/20044601",
      "price": 500,
      "category": "gpu",
      "source": "blocket",
      "original_price": 3500,
      "original_price_is_estimated": true,
      "discount_percent": 86,
      "product_model": null
    },
    {
      "title": "Tangentbord och mus med RGB-belysning",
      "url": "https://www.blocket.se/recommerce/forsale/item/19655119",
      "price": 400,
      "category": "keyboard",
      "source": "blocket",
      "original_price": 800,
      "original_price_is_estimated": true,
      "discount_percent": 50,
      "product_model": null
    },
    {
      "title": "Mousetrapper ergonomiskt tangentbord och mus svart USB",
      "url": "https://www.blocket.se/recommerce/forsale/item/22557573",
      "price": 700,
      "category": "keyboard",
      "source": "blocket",
      "original_price": 800,
      "original_price_is_estimated": true,
      "discount_percent": 12,
      "product_model": null
    },
    {
      "title": "Apple Magic Keyboard och Magic Mouse vit tangentbord och mus",
      "url": "https://www.blocket.se/recommerce/forsale/item/22557206",
      "price": 599,
      "category": "keyboard",
      "source": "blocket",
      "original_price": 800,
      "original_price_is_estimated": true,
      "discount_percent": 25,
      "product_model": "Apple MAGIC"
    },
    {
      "title": "Xtrfy RGB Tangentbord",
      "url": "https://www.blocket.se/recommerce/forsale/item/19017611",
      "price": 180,
      "category": "keyboard",
      "source": "blocket",
      "original_price": 800,
      "original_price_is_estimated": true,
      "discount_percent": 78,
      "product_model": null
    },
    {
      "title": "Ergonomiskt tangentbord iiglo ERGO LED-Backlight Ej Öppnad",
      "url": "https://www.blocket.se/recommerce/forsale/item/22549795",
      "price": 200,
      "category": "keyboard",
      "source": "blocket",
      "original_price": 800,
      "original_price_is_estimated": true,
      "discount_percent": 75,
      "product_model": null
    },
    {
      "title": "Apple Magic Keyboard tangentbord vitt",
      "url": "https://www.blocket.se/recommerce/forsale/item/22545659",
      "price": 850,
      "category": "keyboard",
      "source": "blocket",
      "original_price": 800,
      "original_price_is_estimated": true,
      "discount_percent": null,
      "product_model": "Apple MAGIC"
    },
    {
      "title": "Tangentbord varmillo mx blue",
      "url": "https://www.blocket.se/recommerce/forsale/item/22544496",
      "price": 600,
      "category": "keyboard",
      "source": "blocket",
      "original_price": 800,
      "original_price_is_estimated": true,
      "discount_percent": 25,
      "product_model": null
    },
    {
      "title": "Razer Ornata V3 tangentbord svart med handledsstöd",
      "url": "https://www.blocket.se/recommerce/forsale/item/22542747",
      "price": 500,
      "category": "keyboard",
      "source": "blocket",
      "original_price": 800,
      "original_price_is_estimated": true,
      "discount_percent": 38,
      "product_model": "Razer ORNATA"
    },
    {
      "title": "HyperX Alloy Origins 60 Tangentbord",
      "url": "https://www.blocket.se/recommerce/forsale/item/17915021",
      "price": 550,
      "category": "keyboard",
      "source": "blocket",
      "original_price": 800,
      "original_price_is_estimated": true,
      "discount_percent": 31,
      "product_model": "Hyperx ALLOY"
    },
    {
      "title": "HyperX Alloy Core RGB Tangentbord",
      "url": "https://www.blocket.se/recommerce/forsale/item/17915008",
      "price": 300,
      "category": "keyboard",
      "source": "blocket",
      "original_price": 800,
      "original_price_is_estimated": true,
      "discount_percent": 62,
      "product_model": "Hyperx ALLOY"
    },
    {
      "title": "Apex PRO mini wireless RGB trådlöst tangentbord svart",
      "url": "https://www.blocket.se/recommerce/forsale/item/22537451",
      "price": 1250,
      "category": "keyboard",
      "source": "blocket",
      "original_price": 800,
      "original_price_is_estimated": true,
      "discount_percent": null,
      "product_model": null
    },
    {
      "title": "Logitech tangentbord trådlöst svart",
      "url": "https://www.blocket.se/recommerce/forsale/item/22530882",
      "price": 99,
      "category": "keyboard",
      "source": "blocket",
      "original_price": 800,
      "original_price_is_estimated": true,
      "discount_percent": 88,
      "product_model": "Logitech keyboard"
    },
    {
      "title": "Sony trådlöst gaming-headset svart/vitt med USB-mottagare",
      "url": "https://www.blocket.se/recommerce/forsale/item/22559720",
      "price": 500,
      "category": "headset",
      "source": "blocket",
      "original_price": null,
      "original_price_is_estimated": false,
      "discount_percent": null,
      "product_model": null
    },
    {
      "title": "Meta Quest 3 VR-headset vit",
      "url": "https://www.blocket.se/recommerce/forsale/item/22558802",
      "price": 5399,
      "category": "vr_headset",
      "source": "blocket",